Id,Message
1290812853818187779,não sei oq é melhor nesse vídeo kkkkkkkk
1290812738663600131,a verdade é ele está louco tentando pegar o mvp  pode até prejudicar eles o foda é que ele deve estar puto com lzin e thur sendo que é ele que está prejudicando o time
1290812484555878400,ainda bem que eles abriram muita vantagem nós dias anteriores pq olha bak deve tá muito puto
1290812308139257861,nem sempre temos uma fase boa e essa fase não está sendo agora até porque está tendo menos treinos os meninos vão melhorar só é uma fase
1290812230330712066,bak deve ta só o odio
1290811748354871296,também tô achandotem que rolar demissão nesse timebak só rotação erradathur só mídia lzinn não preciso falar nada horrívele o jordan o pior suporte do mundo vergonha desse time quem concorda comigo respira
1290810951441227778,laude está horrível não sei o que está acontecendo com o   narrar nada  esquece
1290810720603582465,laude está horrível  errando na call e colocando a culpa no time tnc desisto
1290810570787246083,depois de ler bak sonha com d4nt3s e acorda com thur eu nem assisto mais kkkkkkkkk
1290810075003736065,tnc laude passando call de maluco rush sem necessidade vtnc  deixa o  passar call
1290809101774131202,simsó muda o servidor eu acho
1290806142923411461,oi deus eu só queria te pedir q o bak faça uma rotação perfeita que o thur seja a criança satânica da 12 poderosa como smp q o lzinn tome muito fusion e que o jj pegue 2 awm
1290805875624546307,todas as cidades do gta são iguais
1290804860749840384,ghost vinga qm matou o bak pf
1290803293875306498,ghost vai cobra eles mataram o bak seu namorado
1290803229593411589,treino q é bom nada
1290802991352754176,olha esse bak vei
1290801955212873728,nao fala do bak cara
1290801596654387202,bak pegadinhas show trolada novamente com a live aberta sem querer muhahaha
1290801375174107140,quando a nimo notifica é o bak trolando
1290801372489756672,o bak do nada abriu live e fechou  não dá irmão kkk
1290801192197660673,bak abriu live sem quere e minha nimo nem notifico kiria vê
1290800737556013061,nem fudendo que o bak abriu live sem querer
1290800509272698880,eu to rindo  qual foi bak
1290800440448290816,sem graça jogar no time do bak se doido
1290800212856930304,não aguento mais ser feita de palhaça pelo gabriel
1290800177343848456,ctz q o bak foi gravar a partida e abriu live kkkkkkk aí num é burro n o minino
1290799943129747457,bak abriu live na hora do camp  se desesperou p fechar certeza
1290799883595784193,o bak abriu live sem querer e agr tem 5k de pessoas no chat sendo tapeados
1290799851043794949,mentira q o bak abriu live skskksks
1290799763651276802,bak abriu livectz que era pra colocar pra gravar e errou kkkkķ
1290799610194268161,o bak véi kkkk
1290799591764434947,notificou live do bak pra mim
1290799498340511744,e o bak q abriu live kkkkk
1290799341788188672,uai bak abriu live kkkkkk
1290799023763468288,o bak não abriu live sem querer não né
1290797877632081920,já dizia o menino bak faz o p de meu pau na tua mão rsrs
1290796967128436737,teve 4 abates três pro bak e um pro lzinn
1290796607693258753,será pq bak você tem dinheiro
1290796311160160256,miada não 4x3 apenas mas o bak tem 6 nfa vale por 2
1290796076631494658,falou mal de mim  falou mal do bak
1290795561453588481,bak do céu
1290789353145405448,exatamente igual o bak disse que se algum time quiser passar eles vão ter que quebrar a call
1290789111280934914,ahshha tipe bak
1290787649750478848,confira minha transmissão do meu playstation 4  fortnite live at
1290787075017646087,te amo vei
1290786542278057984,bak vai te comer na porrada narigudo
1290786430596374531,pooo grava com os atuais e antigos da b4 ex facção leeboy e bak
1290785745326809091,malu vc é pfta sabe
1290784219845861376,pq q tio bak é tão bom né
1290782133003444224,eu vivo na espera de poder comer um tio bak
1290782028519137282,vou mandar o bak p sua casa
1290781332457639941,surata bak shahshshhs
1290779127436509186,bom bom
1290775249915609089,gente o bak é igualzinho o gl até pq o gl era cpt dele kkkk pelo amor de deus bronca é normal
1290772872798130178,boa sorte hj amassem
1290771320800772097,esperando voce e bak pra marcarmos juntos gtlt
1290770563003297799,o bak é muito  misericórdia dono da loud e do meu coração
1290769696913006592,o véi eu tô chorando com o vídeo q o bak postou do camp do nobru até quando isso mds
1290768933272920064,pra a mina achar o bak gostoso pqp
1290767004505460736,eu amo vocês de um tanto
1290761789253222400,mais o bak diz que é biscoito
1290761113617997831,bdl hoje vai ser so o estresse thur sem a sense net do cranco do jon e do lzinn e um bak com a verdadeira mira
1290760700302958593,o que o bak disse no começo
1290760363441618944,melhor q ele tem cara de ser igualzinho o bak
1290760151369232392,benim yerime de bak hshdhshhs
1290756006536982534,amo vcsde uma forma q eu não sei explica choro muito por causa da vcs mais por amor e carinho q tenho por vcs loud sempre
1290754894840856585,alguém tem essa foto do bak não achei no feed dele acho que essa tá cortada
1290754569610428416,saudades bak na mansão loud melhor canal
1290750356880871426,amanhã no nosso instagram do
1290750009470865415,deus é bom ou o dinheiro não sei  bak loud
1290749622936313861,calmaaaa o bak e meio indeciso com essas coisas já já ele decide
1290747321299468291,ahdhhshaj derde bak derde
1290744034978398210,criar um time e contratar o bak
1290743343346003969,parece q vai ser bak tinha comentado em alguma live
1290743199875698690,o bak que não abre os olhos com o tiringa n
1290738215708758016,fei q dropou a balinha aqui no trampo quer dropa um papel no horário de serviço kkkkkkkkkkk quero nem vê o bak do mano kkkkkkk
1290736549320065027,kkk amo
1290735017325481985,bom como disse não sou ninguém para falar pq realmente rolou lá
1290729584737091584,quando o bak tá muito quieto e fala uma palavra a cada 50min eu me sinto oprimida
1290728662334046216,sou fan do bak babictor s2 kkkkkk ph e muito engraçado
1290722549379338242,todos são bons estão no mesmo nivel é thurzin é mais agressivo bak é mais frio e calculista jordan é exepcional nem preciso falar lzin é mt inteligente em suas jogadas e joga demais eles são um time estão no mesmo nível de jogo
1290721752440541198,tava com saudade
1290718842126204928,pra mim competitivo sem will e bak é tipo fica faltando algo
1290718145292963849,elah faz o lomotif fiquei tonta
1290716775638880260,eu sem entender nada queria ter a disposição de acompanhar as lives do bak que nem vcs tão sempre por dentro de tudo kkkk
1290716670789660676,sou flopada então
1290716553722429441,faltou o celta do lzinn
1290716069758472197,é foda  e a mira ontem do bak tava ruim imagina hoj entt
1290716030428483584,loud kronnos é meu sonho pqp mlk é fã da loud já disse até em live que o melhor jogador que ele já viu é o bak
1290715568262262785,bak disse q da zika se eles treina no dia do camp kkk tem q ir de cabeça erguida
1290714918665191425,nossa
1290714827090952194,tá ligado né
1290714732274561024,fiquei cega
1290714432641867776,qual foi cjs o que é que aconteceu
1290713799377461255,porra mano o will é um dos mais focados do time ele ama competitivo e sempre vejo ele tentando aprender mais quando tá em live jogando com o bak e outros emuladores até quando tão na resenha ele fica perguntando sobre call e outras coisas se ele sair vou tiltar
1290712944649678849,verdadecom aquele chat insuportável de ontemtem que ter muita paciência
1290711975702429698,boa sorte na bdl
1290711667786100738,melhor live é a suate amo tanto
1290711300138557442,acho que ele nem vai jogar mais pela laude ontem ele tava jogando com o bak mas vi pouca coisa da live não sei se falaram sobre isso ele tem potencial no emulador sempe jogou em pc
1290709495451201537,meu sonho que o  curtisse minha clipada mais é só um sonho mesmo
1290708784109826048,queria ver se eles vissem o bak cobrando o time pq eu tenho ctz que o bak cobra geral em busca da melhoria de todos
1290706483680874502,quase certeza que os meninos tao treinando em off o bak n ia ta acordado agora atoa n
1290703576092876800,oha olaya bak paöwjzpwçwjs
1290703007890452481,como entrar na aula online com estilo kkkkkkkk  te  sempre
1290700314216206337,eu também tô que
1290698460547690496,o   vou pro rp pra trocar tirotipo free fire ele no rp
1290697731384717312,bak era pior kkkkkkkk se vcs olhassem iam chamar ele de desumilde e chato kk
1290693204875124740,boa sorte te amo descansa tá
1290693151158603776,mais tarde tem show do bak
1290691411004858369,o bak meu pai que eu levei agora
1290689667726217218,boa sorte vida quebra tudooooo
1290689057786339340,video qe o bak posto do camp do nobru slc top dms
1290688777724272641,mvp em ação na liga bdl
1290686470047571970,é fã do bakmas não usa o x6 enfim a hipocrisia
1290683916538519553,coisa boa meu amor boa sorte t amo
1290683873874108416,blz eu só queria o bak jogando gta
1290681214815305733,conexão kkkkkkk
1290681139619934208,melhorar isso fazer isso q vai dá certo se ele fez isso e não der certo ele vai ter q gritar e berrar mesmo tanto q os meninos na call somente obedeceram e ouviram pq sabe q o gl tá certo o bak mesmo tem hora q fica puto com o lzinn ou thur e é pra melhora do time vcs em plm
1290680493676146690,você não é as 6 nfa do bak mas eu queria ter  alice
1290680119082835974,queria ser o bak mas o bak não posso ser pq o bak tem 6 nfa e eu só quero ter você   júlia
1290680036467580930,assisti o vídeo do bak do booyah na copa nobru e to indignada com eles todos calmos sendo q eu surto assistindo
1290678943629168642,saudades do bak nos videos da loud
1290678885110042624,vc é linso e perfeito demais bak aguento aaaaaaaa
1290672427962380289,48 1155 pedro gato muito linda parece o rushadao da loud parece as nfa do bak parece o thur explanando o bak parece o lzinn de lança parece o jon de awp parece os 500 ponto de diferença da laude na bdl parece 4v4 do estresse muito linda ainda kkkk
1290669837425967114,boa sorte amore mio
1290669427676131329,esse maluco do ong bak bate p crl ta repreendido kkkkkk
1290669103678656518,quero hype nao bak nao troca com ngm que nem tu nao troca cmg
1290668664933486597,o bak mesmo é assim só procurar nos vídeos antigos dele na época de b4 e você vê que ele sempre falava “ não aceito perder” e sempre coisas do tipo e olha que era filtrado muita coisa pq era postado a única coisa foi que o eltin mostrou em live
1290668393633390593,o bak falando q assiste  no twitter
1290666861139505153,bak postou um vídeo jogando a  que  essa line tem num dá
1290666835424288768,boa sorte hj te amo
1290666047310376962,boa sorte na bdl meu amooor
1290665029033963521,simmm ainda tem gnt q xinga o bak nos xtreinos mas cara se ele é o cpt ele tem q cobrar msm p sempre terem um resultado mlhr
1290664798657622018,na minha opinião o erro foi o elton mostrar a bronca na live fora isso o gl está certo ele está vendo o mal desempenho do time e como cpt tem que cobrar mesmo fora que ele tem q dar resultado pro corinthians já vi o bak falar coisa pior raiai
1290663137209966594,oque rolou foi que o wanheda queria ficar como player e a loud só queria ele como coach aí ele decidiu sair
1290662915813638144,que  eu amo o kaue charli milena isa dixie babi e bak e eu quero toda hora mudar pra um deles tirando a babi que eu já tenho aí eu fico na dúvida tipo agora eu quero fzr um p kaue vou me matar
1290662470735077382,boa sorte na bdlque deus te abençoe sempre
1290660814572204033,vocês vão arrasar como sempre meu amor
1290654956576559112,foda que ela é linda e eu pareço o bak
1290653896071884813,loud bak fala que vai estoura o ret em live e causa alvoroço no chat
1290650841125462018,obg por tudo e por muito
1290649815697764353,sdds ne minha filha de ver o  nos video da loud
1290648536397291524,nem veno meu namorado sensei nao vejo chouji nem tenho shimakaru bak embkra
1290647437628055559,kkkkkkkkkkkk isso ai bakzao
1290645751161409542,eu sempre recebo aquele bak
1290645231285809155,bdia vida  boa sorte hj
1290643367949410307,isso dói minha alma
1290641867751723008,somente agradecer por ngm tá usando a tag
1290641192573698051,torcendo por vocês sempre
1290640650136883201,eu n vejo problema em bloquear alguém por bobeira é meio infantil msm mas fdse deixa eu ser egoísta por um minutinho nn machuca ngm bloquei umas duas vezes por causa do bakgou e do kenny de south park nn me arrependo
1290638277700091904,poxa caras eu devia ter pedido um video do bak também até hoje eu fico triste pq no calor do momento eu so pedi para gravar um video
1290638115019853824,sonhei que eu namorava com o   ai ai oq passa pela minha cabeça em véi n sou normal  mas quem me dera
1290637896396021762,o bak no fundo cabelo na cara e a risadinha do mob
1290637517868412929,obrigada por mais uma live incrível como sempre acabou a live e eu fui de ralo sonin muito
1290632993086803969,e isso seu mitoo
1290632291002331138,live insana ontem
1290630651364945925,agora fala que ele não é meu marido  kl
1290630433500286977,o video do camp no canal do bak tá coisa de outro mundo bom demais ver eles daquele jeito
1290629164966580229,é mesmo mas eu tenho certeza que ele que não quis ficar mesmouma organização tão ciente em escolha de jogadornão deixaria um cara como o wanheda ir embora assim mas agente não sabe oq rola lá dentro entt quem sou eu pra falar algo
1290628476349734920,ai ai estava atoa né e resolvi ne casar em um site  só um aviso  agora você é casado hum só no aguardo da certidão de casamento
1290626139531214848,boa sorte hoje
1290625800954425345,amo todos mas meus  sao o bradoock bak thur jordan e lzinn
1290623691093692419,eu vendo a tag da nossa guilda
1290623136669540352,kkkkkkkk bak rindo por que sabe o que é surto
1290621121226780674,vão com  em vocês
1290620931921018881,só assisti o comecinho da live mas foi muito bom
1290619465231630336,bom dia
1290617173493321729,amassa melhor da história
1290614334897500160,vem  vem  vem  vem  vem  vem  vem aqui
1290614290253307904,vem aqui
1290612228408909827,boa sorte vida te amo mtt
1290611955082854400,lzinn mvp de season só ele e o bak tem anel rs
1290610622502244352,loud em 2 lugar na nfa correto ou não  fala aí espero q a loud chegue em primeiro
1290610477773533185,descalça nenémmas tarde vc vai amassar como sempreboa sorte
1290609477478223872,mara o le nyobile boitumelo bolela nnete
1290608049766506496,melhor parte foi bak qual foi thurzin tá rindo de que  thurzin pain morreu mó rápido mano
1290604148996677632,fiquei até o final da live de  agora vou dormir
1290602469664358401,bom descanso mozi te amo
1290600454037151745,fé em deus que hoje vai dar certo
1290600366585847808,o gabriel me faz tão bemem meio ao caos encontrei refúgio nele
1290600322889637888,te amo mto
1290598699085598720,só o básico live top como smp
1290598453555462144,boa sorte hj na bdl te amo
1290598425277472768,aaaaahhhh coisa boaaaa
1290597840767647745,bom dia meu mano e boa sorte na bdl
1290597821951991811,bom soninho
1290597705799159808,boa sorte no camp hoje
1290597534314962946,a gnt postou quase a mesma coisa kkkkkkkkk amo
1290597268240957441,madrugar vendo a live do bequatroka é a melhor coisa do mundo sim   te amo
1290596717788827648,virar a noite vendo live do bak é a coisa que eu mais amo fazer
1290596697379418113,né isso
1290596679985618945,os mnr do discord do bak é maneirin  gasto a onda com eles kkkkkkkkkkk
1290596621416304641,tudo nosso nada deles
1290596446924943360,né isso
1290595914827083778,mto bom madrugar com o fiel
1290595383358496768,eu toda boiola por ter aparecido no chat no stories do bak kkkkk
1290595187455033344,a live foi muito boa obrigada e boa sorte no camp hoje descansa
1290595141565153281,você merece tudo isso bom dia
1290595126381862913,bom descanso te amo muito
1290595123160592385,agradecer a ti por mais um dia tem que ter muita paciência p fazer live viu muhahaha
1290595102189064192,boa sorte nene vão amassar lá
1290595029862490113,mto eu
1290594977832206336,obrigada por todo seu esforço que você tem diariamente vc é brabo muito obrigada por tudo tenho muito orgulho de ti que tudo que você faz seja recompensado cada vez mais te amo muitao
1290594916905758720,é isso mofi amassa hj
1290594845447380992,obg por tudo e boa sorte hj te amo
1290594841475391488,boa sortete amo
1290594789013041155,né isso
1290594776430116865,eu durmo assistindo as live do bak e acordo com ele finalizando as livepena que não posso mas virar a noiteaulas voltou
1290594773833834496,day 2  eu te amo
1290594760642748418,boa noite e boa sorte mais tarde na bdl
1290594758482710528,boa sorte
1290594753919234048,é isso tudo nosso te amo
1290594724311633922,̧
1290594719429472256,só bora descansa aí
1290594709199556611,descansa até mais tarde p bdl e p mais live né te amo bequatroka
1290594701624725505,e mais um dia eu vou dormir sem o seu boa noite
1290594700345446400,é isso
1290594662315692034,to torcendo por vocês  confio muitoooo
1290594647799103488,boa sorteeee
1290594637648977921,boa sorte lá mais tarde
1290594628513693698,bom dia dorme bem
1290594599254347777,amo mto vc
1290594574155632641,obg por hj vida foi incrível
1290594524973203456,somente agradecer por mais um dia  tarde tem bdl quebrar tudo
1290594488390483968,bom descanso vida
1290594434778832896,vamos de mimir ao infinito e além
1290594430018293760,a hora que eu to acordando tu tá dormindo aiaiai bak
1290594429561188352,um pouquinho só um pouquinho mesmo pq teve muito mais das balas que o  deu na live de hojemira neném demais
1290594427556245505,fui de baseeee só o básico
1290594424624422913,carai ti com moral pedi live com cerol e teve humm análise
1290594423240368128,livezinha hoje foi insanaboa sorte amanhã na bdl
1290594404177190913,
1290594395935461377,descansa viu até mais tarde novamente
1290594386246541312,live até agora eu fui eu tava
1290594373361643520,
1290594341912707072,dorme bem vida te amo
1290594341354962944,
1290594334123982850,boa noite
1290594326372913152,bom descanso te amo
1290594320014344193,te amo obrigada sempre por tudo
1290594317577355264,descansa vidate amo muito
1290594301282582528,dorme bem vida
1290594251743678464,fuii de base
1290593156283719681,bak é o melhor jogador não dá irmão
1290591208612536320,ong bak versão mini kkk
1290588574329470976,dormi bak tava em live acordei e ainda tá kkkkkkkk
1290584855970033664,eu só queria poder retribuir todo o bem que você me faz
1290583781657718784,ainda nem dormi  bak tá em live até agora
1290582385269121024,mano ele esta certo essa tem q ser a atitude do cpt po o bak é mil vez pior
1290581501046853632,se vc é fã do bak e tem seu sono regulado vc está sendo fã errado
1290577058171629568,obrigada pela live de hj gab tu és incrível
1290575888682188800,se não é o amor da minha vida não sei o que quem é
1290565359188180992,o bak joga muito não dá
1290562464443248640,n é de hj q o povo q n faz a minima do q é ta em um camp e n sabe como é a relaçao deles fora do jg qr dar palpite sobre como o cpt lida com o timeisso é com bakglz e mt outroseles tem q entender q eles se conhecem mlhr doq qlqr um e q é pelo bem do timefora sao tds amgs mano
1290562150671556609,live insana hoje meu mano
1290559481580003328,5h da madrugada e eu aqui vendo o 4x4 dos brabos kkkk que resenha hudson cancelou o cod do cerol kkkkkkkkk
1290556068171481090,sdd de vc bebe
1290555480427966466,bak pague minha assinatura no twitter
1290554846387544064,bak pague minha assinatura no twitter
1290552734035451904,não consigo dormir mais uma madrugada olhando live do bak
1290550240827899906,piuzinho bak e cerol fazendo live juntos de madru td p mim
1290549608482037761,mdsss bak voltou tava quase desistindo
1290549424381480960,até agora nada do bak olha viu
1290549287038914560,bak abriu live agr esse mlk é doente
1290544592224432129,oq ove com o pc do bak
1290544485362028544,acho legal que a live do bak cai e vem um monte de gente pro tt
1290544445922979840,oi  pode avisar pra gente se vai voltar ou não pufavo
1290544127872991234,live do bak caiu e p saber se ele vai voltar ou não
1290543695658455041,e eu sou apaixonada pelo bak
1290543564175351808,o pc do bak explodiu kkkkkkkjk
1290543434579750913,pc do bak morreu kkkkkkkkkkk
1290543075358646278,live do bak caiueu triste
1290542862522695680,o pc do bak explodiu
1290542794528956416,o pc do bak apitando parece uma bomba que vai explodir kkkkkkk
1290542617579716610,pc do bak explodiu acabou a live família
1290540606503215104,eh fã do bak mas tem o sono  hipocrisia
1290535984715771904,a única coisa que tem pra fazer nessa madrugada é ver a live do bak
1290535421940846598,bak sempre cai nisso kkkkkkkkkk
1290534861711773696,nossa amg meu deus meu coração ta apertadinho pelo soler se tem uma coisa que eu odeio eh humilhação odiei na época que o bak fez isso com o lucas e agr tb meu deus e o  q
1290534754069225473,eu amo o gl bak posta esse react pfvr
1290534587261759488,rinha de los grandenses na live do bak kkkkkkk
1290534192498053122,nem vi o bak reagindo veir
1290533126654103553,viciei em the 100 pelo  na sinopse é estranho mas é muito pika
1290532597513297920,não consigo  viciei em the 100culpa do
1290531811722964994,não dá estagi o bak está em live ainda
1290531087693885440,bak falando q quer trocar tiro no gta o bak dps
1290530736278245376,o bak com vergonha da mulher do rp falando que pegou um cara que gemia gostoso e era ele kkkkkkkkkkk
1290530571941302272,que dizer que o bak geme gostoso  meu sonho escutar kkkkkkkk
1290530444858007552,chat do bak reclama de  tudo
1290530243258789888,tu não lembra mas a tropa lembra bak
1290528787181051904,bak tá no putero kkkkk quero ver a baixaria
1290526489142796292,pq o bak nn tá jogando na cidade alta
1290524282204958720,cara dentro de ff em coisas sérias vocês vêm bak cobrando o time dele normalmente mais o lzinn pq ele sabe que ele têm capacidade para mais mas fora ele é um amorzinho com lzinn e têm uma amizade linda com ciumes e tudo kkkkk então mano capitão têm de cobrar sim
1290522619549286400,o leeboy e o bak no vídeo  os cara são muito burro cara
1290522496438095872,o chat do bak é   os fãs de gta que só floda essa porra
1290522001992568832,aliás amei o vídeo que o bak postou jogando a copa nobru eles são tão calmos gravando eu acho que eles xingam muito
1290520145413181443,ghost é muito neném do bak não me conformo de não ter eles no mesmo time aaaaaaaaa
1290519744349704199,sonin muito justo na hora que bak foi pro rp
1290519722400849920,né isso povo tem que entender q o bak joga oq ele quiser oporra
1290519175497224193,bak jogando ff o chat reclama e pede gta  bak jogando gta  o chat reclamada e pede ff  não dá pra entender esse povo
1290518401279037442,não dá irmão que chat chato do kralho tiltei com uma guria já a mina acha que o bak liga pra quantas pessoas têm na live quem gosta do bak de vdd vai ficar lá assistindo ele independente do jogo e se tiver achando ruim rala da live porra vai toma no cu
1290518311881646080,to vendo live do bak não quero guerra com ninguém
1290517974110081024,rp so eh bom quando bak e cerol joga de resto so chatice
1290516762501492737,nunca defendi o lzinn quando o bak brigava com eles pq eu tenho noção que o bak é o cpt e tem que cobrar  não acompanho os meninos da bdl e n sei como funciona mas da laude eu falo com propriedade
1290515709232058369,caraaaa chat do bak está muito escroto vey ele é um fofo com todos e ele está cansado deixem jogar oque ele quer porraaaa ele é perfeito e não merece metade do que dizem ao falam só parem
1290515394805940224,os meninos da laude tavam sem treinar e o bak não tava indo  nem nada e eles tavam só o sucoaí vocês tavam time não treina pipipi popopo ah vamo querer
1290514672882458625,com o bak vocês fazem a mesma coisaele cobra dos meninos vocês caem em cima aí quando ele deixa de mãonão cobra treino nem nada vocês reclamam tambéma real é que vocês só sabem reclamar
1290514340093755392,eu tenho que dormir prq amanhã eu acordo cedo mas quem disse que o bak deixa
1290513079533547525,hum so esperar quando o bak gritar com o lzinn e vcs vierem militar sobre arrogância que eu vou lembrar de vcs rindo do soler e strong
1290512911706853377,lembro de muitos daqui atacando o bak por ele falar de tal jeito com o lzinn e eu concordando com o bak pq pra mim cpt é e age assim mas é totalmente incoerente você defender lzinn e rir do soler e do strong que levaram broncas bem piores enfim o favoritismo né rs
1290512514497863684,4x4 do  tá coisa linda
1290511542476247040,nem acreditei que eles perderam ghost virou jogador de camp japex entregando eltin dando só peito e entregando e o bak sempre fazendo a boa
1290510348773134338,e se pa quem tá rindo zoando foram as mesmas pessoas que ficaram no pé do bak quando ele começou a reclamar com o lzinn
1290509992962019328,ta mas cadê a clipada do bak falando reloga reloga vai pra casa do caralho
1290509544712544256,e bak sábado talvez vou aí lança o corte
1290508335775649792,eu sou um conjunto das farpas do bak e jogabilidade do guh kkkkk
1290507950386302977,os cara da line falando que eu apareço com o bak kkkk
1290507410881290240,as mesmas que falam que gl está certo xinga o bak quando ele faz o a com o lucas kkkk enfim a hipocrisia e nem é meme
1290506496938311680,ai esse apelido é tudo tiamu
1290505659188903936,assistir live do bak essa hora é muito engraçado vsf
1290505085617930242,assistir aquela livezinha do bak agr gosto mto
1290502783737769984,muito linda parece o rushadao da loud parece as nfa do bak parece o thur explanando o bak parece o lzinn de lança parece o jon de awp parece os 500 ponto de diferença da laude na bdl parece 4v4 do estresse muito linda
