Id,Message
1290502676254425088,faz a gente desistir de dormir pai joga demais
1290501080946802688,porra se o bak falando alto com o thur falando q ele tava telandoo povo já tava achando ruim imagine isso
1290498696744857600,se fosse o bak falando com o lzinn do jeito que o gl falou com strong e o soler  puta que pariu o tanto de militante que ia ter xingando ele é incontável
1290498356364492800,imagina bak e glz no mesmo time lzinn ia ser só bronca p cá bronca p lá
1290498232057880577,tão avançando em mim bak o bak longe p carai dele ghosbak is real
1290497435970596864,acabei de receber a notícia que meu pai ta com covid e tipo qnd é da tua família ce fica meio pá ne agora q eu senti o bak real mano
1290496791507394560,kkkkkk acabei de ver na live do bak isso
1290495291137769474,mal num sim
1290494122294304776,dia que eu usar um icon por muito tempo que não seja do zayn ou do bak é pq tô possuída
1290492361550606337,atenção pro melhor squad do 4x4 do estresse bak ghost eltin e rusty boa noite
1290492151772536832,o bak disfarçando que gostou de ficar no time do ghost ai ai
1290491795692900353,será se qnd bak ta puto ele fala assim c os meninos tbm análise
1290490800325799939,ghost e bak no mesmo time no 4v4 amo q eles quase smp tão no mesmo
1290489740261613568,e o bak ainda tá com ciúmes do rafis
1290489417811992577,tava só vendo o povo falando que o bak ensinou o gl a ser capitão kkkkkkkkkkk bak que aprendeu com ele porra
1290488828784869377,eu vai na msm sala que o bak aaaaaaa
1290486869885513731,vou ficar vendo a live do bak até eu pegar no sono
1290484207668432898,vídeo do bak tá maravilhoso
1290483671250505733,to triste apenas o cafuné de  pode me curar
1290482692782297088,e aí bakzin vai ser na sua ou na dela
1290482533755285506,vtnc o bak joga muito fora do normal
1290482424342695941,bak joga mt vei não daaaaaa
1290482366561964033,puta merda bak 17 abates sozinho
1290481692415688707,me senti o bak em 2 hrs de emulador
1290480324170850304,bak é muito bom vai tomar no cu
1290480157778558982,eu que lute cm sua live e com a live do bak coloca a web cam maior um pouco p dar pra tirar print
1290479354556760064,eu fui pesquisar pra saber como consertava mas fiz o favor de excluir o que terminava em bak
1290478321919127556,achei superficial o vídeo afinal todo mundo já sabia que o bak tava gravando  esta partida no canal do bak não é igual as partidas que não foram gravadas
1290478232832061441,achei q bak gritava em dia de camp mas agora vi glz e drg pqp
1290477393325379586,não entendi pq estão flodando loud gizão do nada na live do bak
1290476826897182720,a a a a a vamo
1290475523055980544,vi o vídeo do bak e eles jogam camp numa calma parece que é uma partida bermuda casual véi muito bom ver eles jogando ta maluko
1290475115625328640,mano oq mais tem e play indo na boca compra bak
1290475010772086785,queria namorar  alguém que
1290472522899755008,acabei de assistir o vídeo novo do canal do bak com o booyah na copa do nobru e mano a call deles é surreal eles ficam calmos num nível q nem da p acreditar e eu tenho tanto orgulho deles a cada dia q se passa eles estão se superando eu amo esses meninos nmrl
1290471872572936193,ta agr eu tb quero um carro com a placa bak kkkkkk
1290471111298351105,bak eu to acostumada com você jogando 4x4 trate de joga viu
1290470524313796608,abrir a live do bak e escutar o barulho ensurdecedor da scar sem silenciador é realmente saber que vc ta na live do bak
1290470239633846272,n sei amg mas o bak disse q não ia joga
1290469457119318018,eu não aguento mais o bak sendo infectado pelo virus do gta
1290469181197090819,assistir essa livezinha do bak
1290465781973745664,a última vez que vi a los dar boyahho bak tinha acabado de entrar na
1290465360001540099,pra ser campeão da nfa tem que contratar o bak
1290464954043314176,ele tá em sp cerol ligou pro bak ontem e tava fac e japa do corinthians e nos storys japa falou que tava com o misterioso
1290464717752893440,deus eu só queria a gadinha na copa nobruo foda é que ontem de madruga mandei mensagem pro ig da copa nobru pedindo a  chance deus
1290464134572761088,nfa ou copa nobru
1290464053505253382,insta ou twitter
1290464045296947208,a calma que eles jogam é surreal vídeo gostozin de assistir
1290463615766667264,é cirilo eles me deixam toda tchubirau daum daum
1290463591938895875,oiiie deussou eu dnv
1290462687407874048,oiie nobrupfvr eu peço com td meu  a  pfrvvou te dar alguns motivosela é super   em tudoe querendo ou não ela consegue inspirar milhares e milhares de garotas a cada dia que passachama a gadinha pfvr
1290462569052995594,o único rei da nfa é o bak
1290462514040442885,tava vendo o vídeo novo do bak e eu ainda não entendo a jogabilidade do thur mano pqp surreal
1290462251573551107,eu me doeio eu me odeio eu ano gayento mais eu nao aguento mais set um flopado de merdw wue bak consegue manter uma merda de amizade eu nao aguento mais nao conseguir acreditar em nada wue me falem eu odeio eu odeio eu me odieo wue nerda
1290461849713025031,vídeo novo no canal do  mostrando o booyah na copa nobru e como é a call em campeonatos assim vão lá assistir
1290460806178639872,bak voltou a postar partida de camp no canal
1290460291617239047,vão lá
1290458355706867714,bak querendo fazer ppp com a tropa quando for pra sp análise
1290458092455579649,notificação loudbak postou uma nova foto eu
1290456834822868993,o vídeo do bak tá perfeitoo
1290456033530437633,e eu que me vi torcendo pra los enquanto estava assistindo nfa hoje eu posso colocar a culpa toda no bak e no 4v4
1290455834602987520,aqui estou eu denovo e já que os casters perguntaram eu vou responder com a mesma teoria nfa tem 3 letras bak tem 3 letras loud tem 2 nfa e ganhando mais uma fica com 3 preciso falar mais algo opan
1290455770727952396,o campeão vai ser a loud ai o nome será liga bak
1290455751962624003,eu e a letícia achando que o bak ia jogar com a voltan
1290455600963493888,como o samucão acabou de falar bak domina tudo  laude campeão mais uma
1290453157278101505,bak voltou com os vídeos de camp no canalameii
1290452938188619777,pq tu n conheceu o bak ainda
1290452935030210563,depois que o bak saiu a b4 nunca foi a mesma
1290451584984461313,o vídeo do bak ta tão bom o leeboy motivando cada um deles só teve uns xingamentos do nada mas foi legal de ver como é na hora como cada um se motiva e se cobra e ainda dá uma farpadinha na pain rs
1290451262245347330,tony jaa quando fez ong bak tava no auge da beleza dele nossa ou sou cachorrinha d desse homem
1290450662531239936,o menino “te amo” o bak também te amo molecote aaaa véi
1290450359694036998,aleatóriote amo bak bak tb te amo mlk” que inferno
1290450324982038531,o  tá doutrinando na controle total na padrão vai tirar o lugar do bak kkkk
1290449863235244037,tá bom manda bj lá
1290449853001224193,bakzin vai lançar uma bmw quando
1290449822672191492,o bradoock vai jogar com o bak
1290448168296034305,thur se deitar um eu vou bak bak eu vou de qualquer jeito um deus esse cara é um deus
1290448135651758081,colando cria
1290447306517512192,é incrível como o bak consegue me acalmar vei oq ele me transmite é um bagulho surreal
1290446885577252875,em vc todo tempo
1290446030400520194,coisa boa já to aqui
1290445984502349825,kkkk sempre rolaa
1290445316622254083,será que um dia o bak vai me notar
1290445137676558338,ae porra brotei
1290444932990279683,coisa boaaaa
1290444804573323264,amém
1290444621210947590,coisa boooa
1290444592165392387,bora
1290444563660800005,quer entra na minha  eu nobru e bak e vc
1290444445159247873,biel queria te dizer que o video de hoje está maravilhoso como é bom ver vocês se  me deixou com o coração quentinho espero que você consiga trazer mais videos como esse eu te amo
1290444273280835585,vídeo novo do bak tá muito brabo
1290444257950564354,to assistindo o vídeo do bak daí chega notificação de live dele calmae gabriel
1290444093546520577,esses dias minha amiga prima me chamo no whatsapp e falou bem assim bem que você poderia namorar o  eu só respondi kkkkkkk se sonha muito alto kkkkk tenho print se quiserem ver eu posto aqui kkkk
1290443561964535809,pensava q essa porra não funcionava vey kkkkkkkkk dei mole dms kkkkkk
1290443424617967616,tomara que o bak faça mais vídeos jogando camp
1290443265062379520,já foram assistir o vídeo do bak tá muito bommmm
1290442730871693313,amigaaaaa
1290442489246224385,o thur jon tá com duas awp brilha lzinn amassa bak vê se tô bugado na pedra kkkkkkkkkkkk fofo
1290442488138915842,lembrei de tu kkkkkkkk foi afrontar a danger deu mole ksksk
1290442154020605952,bak soltou vídeozinho do booyah do camp do nobru
1290441816903503872,nao tem laude hoje mas venho lembrar que ninguém troca com a tropa do bak muito menos a faz o p haha
1290441671310741504,nao tem laude hoje mas venho lembrar que ninguém troca com a tropa do bak muito menos a faz o p
1290441266791165952,o vídeo do bak eles jogando camp sério porém com uma  vei
1290440991191830528,vc lindaaa
1290440628401307651,uma deusa grega
1290440324582715392,vemk meus gadin
1290440209608445952,corre aqui seus gato
1290440082827214848,meu deustô realizada
1290439956612157441,quero um vídeo polêmico com o  é  no mesmo vídeo pra onteeeeem
1290437922584502281,o vontade de guardar a irmã do bak num potinho
1290436650984771586,te amo muito irmã
1290435488332095490,tô aguardando
1290434907811057664,ja eu tô com saudades do que a gente não viveu ainda bequatroka
1290434707528847360,cade cadê
1290434488237993986,ksksksks ida bem que nao acreditoy
1290433853404913665,hj o bak vai doutrinar
1290433748723544066,e você tem várias opções de uber
1290433183100608513,eu quero live infinita
1290433109499019264,poderia ser na sua
1290433044315344897,acho q hj o bak vai ta inspirado
1290431270674149376,vai deixar o cara te talariar
1290429171500490752,iai ela vai passar aí ou não
1290429121357590529,tudo bem  vc me manda um salve por favor vc e o bak são minha inspiração se não for muito podemos jogar junto por favor
1290428895376945153,o bak ganhou tanta nfa que daqui a pouco vai ser ligabak e nn liga nfa kkkkkkkk
1290428421370195969,quando voce tiver maturidade voce vai entender
1290427510145024001,crlh que consciência to ouvindo ela agr
1290427040483729408,me chama na dm que eu te explico direitinho
1290426724161855488,partiu vê copa bak
1290426524353597440,vai lansar a kombezada qnd
1290425816661274624,só espero q n seja 0000 dnv pq é o horário q sou obrigada a dormir aí quero aproveitar pelo menos um pouquinho da sua live
1290425073967431680,boa sorte na nfa vidan
1290424508080427008,coisa boa
1290424363037200384,amém
1290423918776528896,saiiii namoradinha do dantes
1290423896487927808,só acredito vendo kkkkkkk
1290423869573140483,sdds de australiar né meu filho
1290421517201952770,abre cedo pra vc finalizar mais cedo e descansar bak
1290421110308327426,que deus faça isso acontecer
1290421030087950336,suziane namorada do el gato
1290420869014138883,só falta o seu neh kkkkk
1290420806523269120,não entendi sou lerdo
1290420456424701953,kkkkkkkkkk sim
1290419593438285825,tira a carteira aié pro meu tcc
1290419120891207689,bak abrindo live antes das 22hmmmmmm algo de errado não está certo
1290418985259991042,amém
1290418945095348225,saudades de aglomerar
1290418895711539200,foi brabo dms tras mais vezes eles
1290418757559627781,esperando o senhor no nosso post de 1 ano tlgd
1290418747103215616,live cedo nossa o que rolou
1290418282688917505,eu tbm eu tbm
1290417655506231298,só falta o seu pra completar o desfile
1290417629107281930,tá foda
1290417596521762822,coisaaaaa boaaaa
1290417380439580672,difícil ter mais vamos vê né
1290417366115979264,vai ter 4×4 hj
1290416991745060872,slk essa músic pqp
1290416974913208323,a tropa ta na pista msm ein
1290416944957599744,só falta o seu
1290416870710022149,amém né malvado
1290416586462035969,vc disse q qnd fosse pra são paulo ia lançar um carro bakzin
1290416501409878016,será se era eu mesmo
1290416466911735808,eu quero esse treco me manda pfv
1290416254667325440,brincadeira do   1  2  3  4  5 não sei 6  7
1290416227136004096,vai lançar o seu quando meu cria
1290416190062505985,pra ver ong bak
1290416154490687489,vem nunk
1290416133330411522,calma vou tomar banho
1290416061565853696,não sou carro mas se você me beijar eu deixo vc dirigir meu coração uooooo meu lençol dobrado já tá todo bagunçado
1290416028879642625,quando eu puder ir pros rolês minha mãe só vai me ver em casa 2 meses depois kkkk
1290415999045574656,rp coisa boaaa
1290415970394214402,kkkk vlw amg
1290415959870566400,sdds neh meu filho
1290415950899163138,blz te amo
1290415868346871810,obrigadaaaa
1290415832892428288,tem que aprender dirigir gabriel
1290415808376705029,vai tirar carteira nunk
1290415800260722688,sdds de viajar contigo afff
1290415798411026432,coisa mais que boaa
1290415792815656960,várias caronas pros rolê
1290415788537655298,gta com leeboy hj pfv dadin
1290415780144787458,eu nem precisei gadear me gadearam  entra que tá coisa boa
1290415701853962242,mas avisa aq assim q abrir viu nimo não notifica
1290415693821808641,vemk corno
1290415671814348800,será que essa música toca na live de hoje
1290415645759283205,oi te amo obrigada por existir na minha vida
1290415626553561089,beleza mo
1290415618219544578,eu te amo muito
1290415578184921090,sabia q eu te amo
1290415572757479429,tá bom nenê
1290415561239859208,ღ eu te amo ღ 0308
1290415543711928320,eu indo assistir
1290415526712414208,coisaaaaa boa neném
1290415522467713024,live infinita hoje ou nao
1290415521675063301,meu deus finalmente vc
1290415518285955072,uber pra escolher né kkkkk vipzao
1290415491325067264,old q  ver o de td mundo menos o meu
1290415483875975173,se quiser viajar comigo eu aceito
1290415476221390856,que milagre amei continua
1290415465098092544,vai ter rp insano
1290415457971965954,hm te amo vidoka
1290415444042670082,eu amo
1290415420466495488,coisa boua
1290415403408207872,amigos com carro novo seria o novo uber do bequatroka
1290415391311790080,cadê os codiguinnn
1290415390028333056,como eu nunca faço nada não custa nada se divertir um pouco na tua live né é de graça
1290415381090316296,ate que fim
1290415380767399939,tá ouvir um eu te amo é bom mas vcs já viram o bak dizendo isso
1290415374610169857,vai mimir ne certeza
1290415344948072451,olha eu preciso dormir sim porém se tu fizer estarei lá mesmo morrendo
1290415331320750081,fala que me ama rapidinho só pra eu testar um negócio
1290415318163238913,tá vida a gente espera
1290415316904882176,também te amo
1290415306779787265,coisa boa mas é estranho tu abrir live antes das 23
1290415304187752448,cidade alta
1290415283073626113,4x4 hj ou não
1290415277419704326,live cedo isso é um sonho
1290415264132206595,hummmm tu diz isso mas de 0000 tu começa to ligada
1290415249745739777,se falar que me ama
1290415247044628480,lá tava tudo na paz polícia nem passava
1290415235791302658,já te falei que você é meu tudo hoje
1290415231315910662,será se hj eu durmo cedo amém
1290415220884672512,opan novidades em breve será
1290415217915170816,bakzinho apelão
1290415204715700225,entra lá no discord
1290415204451471361,só coisa boaaaaa
1290415202845024256,cuidaaaaaaq que hoje tem
1290415200127070209,sdd de uma austrália né
1290415188739579905,fé irmão
1290415187061866497,ô glória
1290415183895187457,desfilava
1290415180845809672,como sempre vou marcar presença rsrs
1290415176332840960,vídeo novo hj
1290415174676090885,não vou poder acompanhar hoje
1290415172570537988,aindaa kkk
1290415163645075461,ainda meu pivete
1290415159668768769,coisa boa
1290415156900634626,coisa boooa
1290415155805913088,bem na nfa gabriel aí e pika
1290415155013132292,coisa boa amo
1290415152383307785,lá tava na paz polícia nem passava
1290415145903173632,tudinho pra mim
1290415145190133760,ta bom vida
1290415141096427520,coisa boaa
1290415139976552448,coisa boaaaa
1290415137015373825,coisa boaa
1290415134884626440,coisa boa
1290415128740069376,coisa boa em
1290415128647786497,n sei ainda mas vai ter rpz
1290415122872184835,vai aprender dirigir quando p tu lançar o verdadeiro muhahahah
1290415120796078081,lessa responde aqui oq é kiss me
1290415115427368960,kkkkkkkkkkk sfdvou entrar lá pra ver se arrumo tbm
1290415115108519936,aiaiai la tava tudo na paz polícia nem passava
1290415091205255168,saudades do ano novo né meu filho
1290415085958115335,live 20hrs por ai
1290415068807671810,enquanto eu ando a pé tropeçando nas minhas próprias pernas
1290415046682726405,e vc tem um monte de uber amou bb
1290415034569392128,dá uma olhada aqui meu cria
1290415028823363587,bailão hoje no rp pra descontrair
1290415019843293184,lá tava tudo na paz polícia nem passava
1290415019713351682,olá pessoal boa tarde  minha namorada tem um canal no youtube sobre vlog se eu mandar ao link vocês se inscrevem  ajuda ela bater 1k de inscritos meu sonho é ver 3lq feliz e isso e uma meta e eu quero ajudála
1290415009798008833,1 mês com isso e nada por sorte brasileira
1290415009315594246,roles asim q agente nunca pode esquece  bak 2020
1290414977686351872,e tu desfila levando meu coração na mão
1290414972267384838,ta e live que horas hoje
1290414914146795520,la tava tudo na paz polícia nem passavaaa
1290414911814852609,sdds de viajar cmg né gabriel eu tmb to admito
1290414911198289927,coisa boaaa
1290414881452285952,ali ninguém via mais o sol nascer quadrado
1290414880726626307,sonhei q a favela tava linda e q todas paredes tinha tintabakzin já ta cheio de uber bradoock mob coringa e gs
1290414878008782849,ihhh coisaaa boaaa análise
1290414873650888707,essa é braba fala
1290414872757403651,novibreves em dades
1290414866361135105,sdds de sair de casa nmrl
1290414862892503040,sdds
1290414856265490436,lança o seu mlk
1290414855032373248,taligado
1290414840838840320,falta o seu
1290414822836895744,preciso de você com o victor
1290414815203266560,aiaiai
1290414803614420995,falta sua nave agr
1290414802695868417,eitaa
1290414787197796353,boa coisa
1290414784568008705,eitaa kkkk
1290414784190525444,eita
1290414776569540612,bailão hoje
1290414759624441858,vem pra cabo frio
1290414757955145728,falta o teu né gabriel
1290414749818249217,ai não é humilde o menino
1290414749621125120,coisa boaaaa
1290414730792841217,coisa boa
1290414721024360449,vem pra sp nunk p gnt se trombar nos rolê érriéssi
1290414715668226049,saudade de qnd vc me notava
1290414700677783553,saudades de sair de casa
1290414680284987392,chuva de carro importado os mn desfilava
1290414617580232704,saudades do que a gente ainda não viveu também beck laundi
1290414607874633731,da uma moral lá
1290414605852987392,saudades sono regulado fi kkkkkkkkk tô só o pó
1290414604212994053,sdds das australias da vida né meu filho
1290414598273871873,assim
1290414578699042816,vdd paizão
1290414570352369666,coisa lindaaaa
1290414562718765058,saudades muita de sair também
1290414558864117760,oh sdds de rala a raba no chão até de manhã oh sdds
1290414514505224193,sdds das resenhas com as amigas só os proibidão tocando e a gente balançando a raba
1290414513544744960,sdd d sair d casa
1290414509010685953,saudade todo mundo juntinho
1290414480824901643,australianos e afins
1290414466149089280,saudades até de ir na padaria mofi
1290414449430495233,quando tu vai pra mansão
1290414417029595136,sdds das austrálias né
1290414409958006785,sdds das suas lives de rp cda
1290414408162856961,tenta abrir live mais cedo
1290414393927372800,vai se aquetar fi da michle
1290414392027361285,saudade de uma aglomeração
1290414386759315456,chama os crias pra cabo frio de novo e eu digo se esperava ou n
1290414386515935234,amei vida te amo
1290414386083921921,sdds de você na mansão volta quando pra la
1290414371093577728,sdds do que a gente ainda nem viveu
1290414362428092425,saudades de uma austrália né meu fi
1290414355134255109,sdds de ver isso
1290414355083931650,queria
1290414349702647808,no meu vocabulário fds significa outra coisa
1290414333927788545,sdd da resenha de voces juntos
1290414329418993666,saudades de ver você e os crias em cabo frio
1290414321613373443,sdds austrália
1290414319390400512,eai bak valeu pelo server no discord me rendeu contatinho
1290414316466974722,saudades de ver com os crias
1290414315464527873,saudades de uma australia né
1290414306757095431,viaja pra bh p eu curtir vc
1290414305930813441,sdds eu tenho é da sua live jogando com cerol tlgd
1290414304676716544,vai abrir live que horas
1290414299194720258,saudades de vc na mansão loud
1290414271176888326,aí gabriel se vc soubesse o quanto q eu quero ir pra praia
1290414269775974403,vem p búzios dnv
1290414262792445952,quarentena que não acaba nunca
1290414247751680001,tá bem
1290414229183442945,saudade de você com os crias
1290414192089063427,sdds viajar c os crias pra curtir
1290414119569567744,coisa boaaa
1290414115354300425,oie meu amor te mandei menssagem vai me notar
1290414040402071552,eu amo
1290413989638410241,aindaaaa ja pula pro fds
1290413776882274304,4 um  de alguém especial  amou
1290413611848994823,kkkkkkkkkk é sério mulher por nada
1290413399973728258,se for vdd obg amor mas se for mentira eu quero saber taokei kakkakaak
1290412792600834048,é coisa boa amg te amooo
1290412541143920641,te amo nao sei se foi uma coisa boa mas te amo
1290412167641083904,amg vc é tudinho
1290411163294011392,já convida ela bakzin apelão
1290410976349687808,awwww amg tudo
1290410939486023683,desculpa é que eu sonhei com eles hoje e percebi que sou mil vezes mais obsecada do que eu pensava se não forem um casal algum dia eu acho que fico doente
1290410260839182336,te amo mt minha vidinha
1290410073756401664,vamosss vo te chamar na dm
1290409476718198791,eu te amo
1290408959245983746,kakakakak disse o gado
1290408867390775297,um  e eu te dou 7 motivos para você marcar 1  2  3  4  5  6  7
1290408489165164547,boiola rendida e 100 cadelinha da dudinha
1290406823506456577,kkkkkkkkkkkk vai se ferrar garota
1290406701355732993,é qm é mais falsa no tt
1290406155827793922,aí  vai que é tua meu patrão
1290405692008992769,o tanto que eu sou rendida
1290405594487230466,amo você
1290405409975603204,quero saber qual o 2
1290405241272377345,um  e eu te dou 7 motivos para você marcar 1  2  3  4  5   6  7
1290404768213590016,aparece isso aqui amg
1290404653918826498,fiz isso só que não aparece
1290403818778361856,claro que não uma beldade dessas
1290403383237648392,ti
1290403367039139840,mentira neah
1290402971403145216,manda manda
1290402822270390272,um  e eu te dou 7 motivos para você marcar 1 um  2 um  3 um  4 um  5 um   6 um   7 um
1290401986349760519,você que é
1290401976656723970,não disfarça bakzin nós sabe que você perdeu sua postura de bandido mal
1290401682543775746,te amo também lehzinha você é tudo
1290401500976553987,1 um  que você acha bonitoa aí  gostou
1290401298525954051,eu quero o saber o meu
1290401144292990977,jamais
1290401085400723459,um  e eu te dou 7 motivos para você marcar 7 um  que você ama muito  gostou
1290401069995098113,o meu deve ser pessoa que não suporta na tl
1290400940927995904,gado demais doido kkk
1290400811739209733,roi leticia né você poderia me dizer rs o que significa o 7 erriessi
1290400636459253760,estagi gado dms
1290399979840966658,um  e eu te dou 7 motivos para você marcar 1  2  3  4  5  6  rs 7
1290399360652582912,pior de tudo é que vejo crusher e bak respondendo assim mesmo hahaha
1290399230708908034,iai meu piveteee
1290399199369007104,eai mãe da fac da gaxxxxtação te amo
1290398372357189633,grupo no insta p bak chamem na dm se quiserrrr
1290398142274441226,a você é um amor
1290398026666827776,amo você gabizinha
1290397951043477505,falei q te acho legal nega
1290397079110651905,manda pra mim também aaa
1290396698423054343,um  e eu te dou 7 motivos para você marcar 1 um  2 um  3 um  4 um    5 um  6 um   que nao posso marcar 7 um
1290396383195869184,dois gado
1290395529097216003,el gato falou tão mal do ghost só foi bak postar spoiler que ele poderia entrar na loud que gato assinou o contrato do menino freguês smp
1290395474168512512,vai que é tua bakizn apelão kkk
1290395419428761601,vou terminar de ver o resto da live do bak
1290394992406597633,sabe q ta falando p ti ne rsrs
1290394564482813952,disse o gado
1290394221506174979,como assim
1290393935169433609,tá dormindo isso é pra tu mrm
1290393295647133699,não como você mas gostaria
1290391841460846592,aí pai se decide logo
1290391368964112391,outro gado falando
1290391058975793153,nossa meu sonho bak lá
1290390994966458368,irmão vc também é gado
1290390872396386307,pressão até cai
1290390610826887171,queria tanto tomar um capa do
1290389995375734785,bak bobao ela tá perguntando a tu cara kkk
1290389654454390793,já tô tão doida que tive a sensação de vê o bak nos storys do coringa olhei de novo e não consigo saber quem é ainda
1290389456248344576,alguém pode me indicar fics do bak pfvrzinho
1290389228581462017,eu quero saber quando é que vocês vão casar aguardando o
1290389067297849344,mansão dos gados
1290388282178707459,qualquer pessoa a mais esse tal de bak nem é tudo isso não fandom
1290387972395806722,kkkkkk competição entre vcs dois ksksk o mais gado
1290387880599330816,amanhã vamos subir tag pro marcos quem vem
1290387714102239233,disse beck laundi o aprendiz do gado leeboy
1290387582057091079,da uma ajuda aq pf
1290387554596818945,tá e o nosso natal bak
1290387529204740097,day 33   eu te amo vidinha você é meu maior orgulho continue forte e nunca desista das coisas que você sonha o mundo é seu e você merece conquistar tudo oq quer
1290387262757363712,eu esperando o  ver meu fix
1290387190741110788,queria que você fizesse essa proposta pra mim lessa
